Contract Type,Provider ID,Program Name,Sponsor Name,Program Address,Program Borough,Program Zipcode,Program Phone
NEIGHBORHOOD SENIOR CENTE,21Q01,WYCKOFF GARDENS NEIGHBORHOOD SENIOR CTR,SPANISH SPEAKING ELDERLY COUNCIL RAICES INC.,280 WYCKOFF STREET,BROOKLYN,11217,718-237-1802 
NEIGHBORHOOD SENIOR CENTE,21T01,VAN DYKE NEIGHBORHOOD SENIOR CENTER,WAYSIDE OUT-REACH DEVELOPMENT INC ,430 DUMONT AVENUE,BROOKLYN,11212,718-385-1110 
NEIGHBORHOOD SENIOR CENTE,21U01,STUYVESANT HEIGHTS NEIGHBORHOOD SC,FORT GREENE COUNCIL ,562-574 MADISON STREET,BROOKLYN,11221,718-230-0824 
NEIGHBORHOOD SENIOR CENTE,22401,OCEAN PARKWAY NEIGHBORHOOD SENIOR CENTER,JEWISH COMMUNITY COUNCIL OF GREATER CONEY ISLAND I,1960 EAST 7TH STREET,BROOKLYN,11223,718-449-5000 
NEIGHBORHOOD SENIOR CENTE,22501,MIDWOOD NEIGHBORHOOD SENIOR CENTER,BERGEN BASIN COMMUNITY DEVELOPMENT CORPORATION DBA,2164 RALPH AVENUE,BROOKLYN,11234,718-253-5557 
NEIGHBORHOOD SENIOR CENTE,22502,MILL BASIN NEIGHBORHOOD SENIOR CENTER,BERGEN BASIN COMMUNITY DEVELOPMENT CORPORATION DBA,2075 EAST 68TH STREET,BROOKLYN,11234,718-444-3850 
NEIGHBORHOOD SENIOR CENTE,22801,CCNS NARROWS NEIGHBORHOOD SR CTR,CATHOLIC CHARITIES NEIGHBORHOOD SERVICES INC,933 54TH STREET,BROOKLYN,11219,718-232-2311 
NEIGHBORHOOD SENIOR CENTE,22A01,BENSONHURST NEIGHBORHOOD SENIOR CENTER,EDITH AND CARL MARKS JEWISH COMMUNITY HOUSE OF BEN,7802 BAY PARKWAY,BROOKLYN,11214,718-331-6800 
NEIGHBORHOOD SENIOR CENTE,22B01,SUNSET PARK NEIGHBORHOOD SENIOR CENTER,SUNSET PARK HEALTH COUNCIL INC d/b/a FAMILY HEALTH,4520 4TH AVENUE,BROOKLYN,11220,718-210-1050 
NEIGHBORHOOD SENIOR CENTE,22E01,YOUNG ISRAEL SR SERVICES NBH SR CTR,YOUNG ISRAEL PROGRAMS INC  ,1694 OCEAN AVENUE,BROOKLYN,11230,718-253-7800 
NEIGHBORHOOD SENIOR CENTE,22K01,CCNS ST LOUIS NEIGHBORHOOD SENIOR CENTER,CATHOLIC CHARITIES NEIGHBORHOOD SERVICES INC,230 KINGSTON AVENUE,BROOKLYN,11213,718-771-7945 
NEIGHBORHOOD SENIOR CENTE,22L01,SENIOR ALLIANCE NEIGHBORHOOD SENIOR CTR,THE JEWISH ASSOCIATION FOR SERVICES FOR THE AGED ,161 CORBIN PLACE,BROOKLYN,11235,718-646-4100 
NEIGHBORHOOD SENIOR CENTE,22M01,GRANT SQUARE NEIGHBORHOOD SENIOR CENTER,FORT GREENE COUNCIL ,19 Rogers Avenue,BROOKLYN,11216,718-363-3133 
NEIGHBORHOOD SENIOR CENTE,22N01,HOMECREST BENSONHURST NEIGHBORHOOD SR CT,HOMECREST COMMUNITY SERVICES INC ,7907 NEW UTRECHT AVENUE,BROOKLYN,11214,718-621-7960 
NEIGHBORHOOD SENIOR CENTE,22P01,VANDALIA NEIGHBORHOOD SENIOR CENTER,BERGEN BASIN COMMUNITY DEVELOPMENT CORPORATION DBA,47 VANDALIA AVENUE,BROOKLYN,11239,718-272-3949 
NEIGHBORHOOD SENIOR CENTE,22R01,ABE STARK NEIGHBORHOOD SENIOR CENTER,BERGEN BASIN COMMUNITY DEVELOPMENT CORPORATION DBA,10315 FARRAGUT ROAD,BROOKLYN,11236,718-272-9515 
NEIGHBORHOOD SENIOR CENTE,22T01,JAY-HARAMA NEIGHBORHOOD SENIOR CENTER,JEWISH COMMUNITY COUNCIL OF GREATER CONEY ISLAND I,2600 OCEAN AVENUE,BROOKLYN,11229,718-891-1110 
NEIGHBORHOOD SENIOR CENTE,22Y01,SAINT GABRIELS NEIGHBORHOOD SENIOR CTR,ST GABRIELS EPISCOPAL CHURCH  ,331 HAWTHORNE STREET,BROOKLYN,11225,718-773-4049 
NEIGHBORHOOD SENIOR CENTE,23201,MANHATTAN BEACH NEIGHBORHOOD SENIOR CTR,THE JEWISH ASSOCIATION FOR SERVICES FOR THE AGED ,60 WEST END AVENUE,BROOKLYN,11235,718-646-1118 
NEIGHBORHOOD SENIOR CENTE,23801,AMICO 59TH ST NEIGHBORHOOD SR CITIZENS C,AMERICAN ITALIAN COALITION OF ORGANIZATIONS INC AM,5901 13TH AVENUE,BROOKLYN,11219,718-972-1558 
NEIGHBORHOOD SENIOR CENTE,23B01,CCNS GLENWOOD NEIGHBORHOOD SENIOR CENTER,CATHOLIC CHARITIES NEIGHBORHOOD SERVICES INC,5701 AVENUE H,BROOKLYN,11234,718-241-7711 
NEIGHBORHOOD SENIOR CENTE,23C01,CCNS THE BAY NEIGHBORHOOD SENIOR CENTER,CATHOLIC CHARITIES NEIGHBORHOOD SERVICES INC,3643 NOSTRAND AVENUE,BROOKLYN,11229,718-648-2053 
NEIGHBORHOOD SENIOR CENTE,23E01,LUNA PARK NEIGHBORHOOD SENIOR CENTER,THE JEWISH ASSOCIATION FOR SERVICES FOR THE AGED ,2880 WEST 12TH STREET,BROOKLYN,11224,718-996-6666 
NEIGHBORHOOD SENIOR CENTE,23F01,TOMPKINS PARK NEIGHBORHOOD SENIOR CENTER,WAYSIDE OUT-REACH DEVELOPMENT INC ,550 GREENE AVENUE,BROOKLYN,11216,718-638-3000 
NEIGHBORHOOD SENIOR CENTE,23F02,ARMSTRONG SOCIAL CLUB,WAYSIDE OUT-REACH DEVELOPMENT INC ,360 NOSTRAND AVENUE,BROOKLYN,11216,718-638-3000 
NEIGHBORHOOD SENIOR CENTE,23G01,ALBANY NEIGHBORHOOD SENIOR CENTER,FORT GREENE COUNCIL ,196 ALBANY AVENUE,BROOKLYN,11213,718-773-2600 
NEIGHBORHOOD SENIOR CENTE,23H01,HAZEL BROOKS NEIGHBORHOOD SENIOR CENTER,FORT GREENE COUNCIL ,961 OCEAN AVENUE,BROOKLYN,11226,347-435-3287 
NEIGHBORHOOD SENIOR CENTE,23K01,CCNS PETE MCGUINNESS NEIGHBORHOOD SR CTR,CATHOLIC CHARITIES NEIGHBORHOOD SERVICES INC,715 LEONARD STREET,BROOKLYN,11222,718-383-1940 
NEIGHBORHOOD SENIOR CENTE,23L01,CCNS ST CHARLES NEIGHBORHOOD SENIOR CENT,CATHOLIC CHARITIES NEIGHBORHOOD SERVICES INC,55 PIERREPONT STREET,BROOKLYN,11201,718-855-0326 
NEIGHBORHOOD SENIOR CENTE,23R01,REMSEN NEIGHBORHOOD SENIOR CENTER,FORT GREENE COUNCIL ,3304 CLARENDON ROAD,BROOKLYN,11203,718-282-1259 
NEIGHBORHOOD SENIOR CENTE,23Y01,TERESA MOORE NEIGHBORHOOD SENIOR CENTER,FORT GREENE COUNCIL ,2702 LINDEN BLVD,BROOKLYN,11208,347-663-7770 
NEIGHBORHOOD SENIOR CENTE,24A01,ROUNDTABLE NEIGHBORHOOD SENIOR CENTER,RISEBORO COMMUNITY PARTNERSHIP INC,1175 GATES AVENUE,BROOKLYN,11221,718-443-1903 
NEIGHBORHOOD SENIOR CENTE,24A02,SARATOGA SQUARE SENIOR CENTER,RISEBORO COMMUNITY PARTNERSHIP INC,930  HALSEY STREET,BROOKLYN,11233,347-425-0676 
NEIGHBORHOOD SENIOR CENTE,24A03,BREVOORT SOCIAL CLUB,RISEBORO COMMUNITY PARTNERSHIP INC,280 RALPH AVENUE,BROOKLYN,11233,347-318-3383 
NEIGHBORHOOD SENIOR CENTE,24A04,STUYVESSANT GARDENS SOCIAL CLUB,RISEBORO COMMUNITY PARTNERSHIP INC,150 MALCOLM X BOULEVARD,BROOKLYN,11221,347-318-3313 
NEIGHBORHOOD SENIOR CENTE,24A05,Palmetto Gardens Social Club,RISEBORO COMMUNITY PARTNERSHIP INC,85 PALMETTO STREET,BROOKLYN,11221,718-676-0876 
NEIGHBORHOOD SENIOR CENTE,24H01,RIDGEWOOD BUSHWICK NEIGHBORHOOD SC,RISEBORO COMMUNITY PARTNERSHIP INC,319 STANHOPE STREET,BROOKLYN,11237,718-366-3038 
NEIGHBORHOOD SENIOR CENTE,24L01,BORINQUEN PLAZ NUTRITION NEIGHBORHOOD SC,RISEBORO COMMUNITY PARTNERSHIP INC,80 SEIGEL STREET,BROOKLYN,11206,718-732-6334 
NEIGHBORHOOD SENIOR CENTE,24P01,HOPE GARDENS MULTI SERVICE NSC,RISEBORO COMMUNITY PARTNERSHIP INC,195 LINDEN STREET,BROOKLYN,11221,718-455-1100 
NEIGHBORHOOD SENIOR CENTE,25W01,SHEUER HOUSE OF CI NEIGHBORHOOD SR CTR,THE JEWISH ASSOCIATION FOR SERVICES FOR THE AGED ,3601 SURF AVENUE,BROOKLYN,11224,718-373-3954 
NEIGHBORHOOD SENIOR CENTE,26301,BORO PARK NEIGHBORHOOD SENIOR CENTER,AGUDATH ISRAEL OF AMERICA COMMUNITY SERVICES INC ,5602 11TH AVENUE,BROOKLYN,11219,718-854-7430 
NEIGHBORHOOD SENIOR CENTE,26401,SHOREFRONT NEIGHBORHOOD SENIOR CENTER,THE JEWISH ASSOCIATION FOR SERVICES FOR THE AGED ,3300 CONEY ISLAND AVENUE,BROOKLYN,11235,718-646-1444 
NEIGHBORHOOD SENIOR CENTE,26601,JASA STARRETT CITY NEIGHBORHOOD SR CTR,THE JEWISH ASSOCIATION FOR SERVICES FOR THE AGED ,1540 VAN SICLEN AVENUE,BROOKLYN,11239,718-642-1010 
NEIGHBORHOOD SENIOR CENTE,26W01,WILLIAMSBURG NEIGHBORHOOD SENIOR CENTER,THE JEWISH ASSOCIATION FOR SERVICES FOR THE AGED ,202 GRAHAM AVENUE,BROOKLYN,11206,718-388-6865 
NEIGHBORHOOD SENIOR CENTE,27401,SR CITIZENS LEAGUE OF MIDWOOD NBH SR. CT,SENIOR CITIZENS LEAGUE OF FLATBUSH INC ,1625  OCEAN AVENUE,BROOKLYN,11230,718-253-0508 
NEIGHBORHOOD SENIOR CENTE,27801,LOS SURES DAVID SANTIAGO NEIGHBORHOOD SC,SOUTHSIDE UNITED HOUSING DEVELOPMENT FUND CORP ,201 SOUTH  4TH STREET,BROOKLYN,11211,718-384-2314 
NEIGHBORHOOD SENIOR CENTE,27802,SWINGING 60S SENIOR CENTER,SOUTHSIDE UNITED HOUSING DEVELOPMENT FUND CORP ,211 Ainslie Street,BROOKLYN,11211,718-963-3793 
NEIGHBORHOOD SENIOR CENTE,27W01,SHORE HILL NEIGHBORHOOD SENIOR CENTER,SUNSET PARK HEALTH COUNCIL INC d/b/a FAMILY HEALTH,9000 SHORE ROAD,BROOKLYN,11209,718-680-7689 
NEIGHBORHOOD SENIOR CENTE,27X01,BAY RIDGE NEIGHBORHOOD SENIOR CENTER,BAY RIDGE CENTER INC d/b/a BAY RIDGE CENTER,411 OVINGTON AVENUE,BROOKLYN,11209,718-748-0650 
NEIGHBORHOOD SENIOR CENTE,28301,HES NEIGHBORHOOD SENIOR CENTER,THE JEWISH ASSOCIATION FOR SERVICES FOR THE AGED ,9502 SEAVIEW AVENUE,BROOKLYN,11236,212-273-5270 
NEIGHBORHOOD SENIOR CENTE,28701,CYPRESS HILLS FULTON ST NBH SR CTZ CTR,CYPRESS HILLS-FULTON STREET SENIOR CITIZENS CENTER,3208 FULTON STREET,BROOKLYN,11208,718-235-0064 
NEIGHBORHOOD SENIOR CENTE,28703,CYPRESS HILLS FULTON ST NBH SR CTZ CTR,CYPRESS HILLS-FULTON STREET SENIOR CITIZENS CENTER,2049 FULTON STREET,BROOKLYN,11208,718-235-0064 
NEIGHBORHOOD SENIOR CENTE,28801,DORCHESTER NEIGHBORHOOD SR CITIZENS CTR,DORCHESTER SENIOR CITIZENS CENTER INC ,1419 DORCHESTER ROAD,BROOKLYN,11226,718-941-6700 
NEIGHBORHOOD SENIOR CENTE,28901,PARK SLOPE CENTER FOR SUCCESSFUL AGING,"HEIGHTS AND HILLS, INC. ",463A 7TH STREET,BROOKLYN,11215,718-832-3726 
NEIGHBORHOOD SENIOR CENTE,28D01,AMICO Eileen Dugan Neighborhood Senior Center,AMERICAN ITALIAN COALITION OF ORGANIZATIONS INC\AM,378 COURT STREET,BROOLYN,11231,718-596-1956 
NEIGHBORHOOD SENIOR CENTE,28K01,CCNS Riverway Innovative Senior Center,CATHOLIC CHARITIES NEIGHBORHOOD SERVICES INC,230 RIVERDALE AVENUE,BROOKLYN,11212,718-942-5345 
NEIGHBORHOOD SENIOR CENTE,29101,COUNCIL CENTER FOR SENIOR CITIZENS NSC,"BROOKLYN SECTION NATIONAL COUNCIL OF JEWISH WOMEN,",1001 QUENTIN ROAD,BROOKLYN,11223,718-627-7680 
NEIGHBORHOOD SENIOR CENTE,29701,SR CITIZENS LEAGUE OF FLATBUSH NBH SR CT,SENIOR CITIZENS LEAGUE OF FLATBUSH INC ,870 OCEAN PARKWAY,BROOKLYN,11230,718-438-7771 
NEIGHBORHOOD SENIOR CENTE,30501,ARC XVI FT WASHINGTON NSC,ARC XVI FORT WASHINGTON INC  ,4111 BROADWAY,NEW YORK,10033,212-781-5700 
NEIGHBORHOOD SENIOR CENTE,30A01,COTHOA LUNCHEON CLUB NEIGHBORHOOD SC,COTHOA LUNCHEON CLUB INC  ,2005 AMSTERDAM AVENUE,NEW YORK,10032,212-781-6580 
NEIGHBORHOOD SENIOR CENTE,30A04,Bethune Neighborhood Senior Center,COTHOA LUNCHEON CLUB INC  ,1970 AMSTERDAM AVENUE,NEW YORK,10032,646-918-7710 
NEIGHBORHOOD SENIOR CENTE,30B01,GRAND COALITION OF SENIORS NSC,GRAND STREET SETTLEMENT INC  ,80 PITT STREET,NEW YORK,10002,646-201-4251 
NEIGHBORHOOD SENIOR CENTE,30H01,NY CHINATOWN NEIGHBORHOOD SENIOR CENTER,CHINESE AMERICAN PLANNING COUNCIL INC,70 MULBERRY STREET,NEW YORK,10013,212-233-8930 
NEIGHBORHOOD SENIOR CENTE,30J01,STEIN NEIGHBORHOOD SENIOR CENTER,STEIN SENIOR CENTER INC,204 EAST 23RD STREET,NEW YORK,10010,646-395-8083 
NEIGHBORHOOD SENIOR CENTE,30L01,WASHINGTON HEIGHTS NEIGHBORHOOD SR CTR,WASHINGTON HEIGHTS COMMUNITY SERVICE INC ,650 WEST 187TH STREET,NEW YORK,10033,212-781-8331 
NEIGHBORHOOD SENIOR CENTE,30U01,DYCKMAN NEIGHBORHOOD SENIOR CENTER,NEW YORK FOUNDATION FOR SENIOR CITIZENS INC ,3754 10TH AVENUE,NEW YORK,10034,212-569-7790 
NEIGHBORHOOD SENIOR CENTE,30V01,GODDARD RIVERSIDE NEIGHBORHOOD SC,GODDARD-RIVERSIDE COMMUNITY CENTER ,593 COLUMBUS AVENUE,NEW YORK,10024,212-873-6600 
NEIGHBORHOOD SENIOR CENTE,30W01,JUDITH C WHITE NEIGHBORHOOD SENIOR CTR,"GREENWICH HOUSE, INC. ",27 BARROW STREET,NEW YORK,10014,212-242-4140 
NEIGHBORHOOD SENIOR CENTE,30X01,CITY HALL NEIGHBORHOOD SENIOR CENTER,HAMILTON MADISON HOUSE INC  ,100 GOLD STREET,NEW YORK,10038,212-788-5580 
NEIGHBORHOOD SENIOR CENTE,30Y01,LAGUARDIA NEIGHBORHOOD SENIOR CENTER,NEW YORK FOUNDATION FOR SENIOR CITIZENS INC ,280 CHERRY STREET,NEW YORK ,10002,212-732-3656 
NEIGHBORHOOD SENIOR CENTE,31201,CARTER BURDEN LUNCHEON CLUB NSC,"CARTER BURDEN NETWORK, INC.",451 EAST 74TH STREET,NEW YORK,10021,212-535-5235 
NEIGHBORHOOD SENIOR CENTE,31202,Carter Burden Roosevelt Island Neighborhood Senior,"CARTER BURDEN NETWORK, INC.",546 MAIN STREET,NEW YORK,10044,212-980-1888 
NEIGHBORHOOD SENIOR CENTE,31801,GAYLORD WHITE NEIGHBORHOOD SENIOR CENTER,UNION SETTLEMENT ASSOCIATION ,2029 SECOND AVENUE,NEW YORK,10029,212-828-6055 
NEIGHBORHOOD SENIOR CENTE,31D01,STANLEY ISAACS NEIGHBORHOOD SENIOR CTR,STANLEY M ISAACS NEIGHBORHOOD CENTER INC ,415 EAST 93RD STREET,NEW YORK,10128,212-666-4910 
NEIGHBORHOOD SENIOR CENTE,31G01,MORIAH OLDER ADULT LUNCHEON NSC,AGUDATH ISRAEL OF AMERICA COMMUNITY SERVICES INC ,90 BENNETT AVENUE,NEW YORK,10033,212-923-5715 
NEIGHBORHOOD SENIOR CENTE,31J01,JEFFERSON HOUSES NSC,UNION SETTLEMENT ASSOCIATION ,2205 FIRST AVENUE,NEW YORK,10029,212-828-6104 
NEIGHBORHOOD SENIOR CENTE,31J02,WASHINGTON LEXINGTON SENIOR CENTER,UNION SETTLEMENT ASSOCIATION ,1775 THIRD AVENUE,NEW YORK,10029,212-828-6104 
NEIGHBORHOOD SENIOR CENTE,31K01,WEINBERG CENTER FOR BALANCED LIVING,THE EDUCATIONAL ALLIANCE INC  ,197 EAST BROADWAY,NEW YORK,10002,646-395-4270 
NEIGHBORHOOD SENIOR CENTE,31U01,FIND AID COFFEEHOUSE NSC,FIND AID FOR THE AGED  ,331 WEST 42ND STREET,NEW YORK,10036,646-545-4621 
NEIGHBORHOOD SENIOR CENTE,31V01,FOOD BANK NEIGHBORHOOD SENIOR CENTER,FOOD BANK FOR NEW YORK CITY,252 WEST 116TH STREET,New York,10026,212-566-7855 
NEIGHBORHOOD SENIOR CENTE,31Y01,CENTER ON THE SQUARE NSC,"GREENWICH HOUSE, INC. ",20 WASHINGTON SQUARE NORTH,NEW YORK,10011,212-777-3555 
NEIGHBORHOOD SENIOR CENTE,32101,INDEPENDENCE PLAZA NEIGHBORHOOD SR CTR,"GREENWICH HOUSE, INC. ",310 GREENWICH STREET,NEW YORK,10013,212-267-0499 
NEIGHBORHOOD SENIOR CENTE,32301,EAST HARLEM NEIGHBORHOOD SENIOR CENTER,EAST HARLEM COUNCIL FOR HUMAN SERVICES INC ,150 EAST 121ST STREET,NEW YORK,10035,212-722-2205 
NEIGHBORHOOD SENIOR CENTE,32601,WEST 65TH STREET CENTER,GODDARD-RIVERSIDE COMMUNITY CENTER ,250 WEST 65th STREET,New York,10023,212-874-0860 
NEIGHBORHOOD SENIOR CENTE,32602,WEST 65TH STREET CENTER,GODDARD-RIVERSIDE COMMUNITY CENTER ,250 WEST 65th STREET,New York,10023,212-874-0860 
NEIGHBORHOOD SENIOR CENTE,32701,JACKIE ROBINSON NEIGHBORHOOD SENIOR CTR,CHARLES A WALBURG MULTI SERVICE ORGANIZATION INC ,1301 AMSTERDAM AVENUE,NEW YORK,10027,212-666-4910 
NEIGHBORHOOD SENIOR CENTE,32801,CANAAN NEIGHBORHOOD SENIOR CENTER,CANAAN BAPTIST CHURCH OF CHRIST ,1428 FIFTH AVENUE,NEW YORK,10035,212-876-2638 
NEIGHBORHOOD SENIOR CENTE,32B01,UNIVERSITY SETTLEMENT NSC,UNIVERSITY SETTLEMENT SOCIETY OF NEW YORK,189 ALLEN STREET,NEW YORK,10002,212-473-8217 
NEIGHBORHOOD SENIOR CENTE,32C01,RIVERSTONE SENIOR LIFE NSC,RIVERSTONE SENIOR LIFE SERVICES INC.,99 FORT WASHINGTON AVENUE,NEW YORK,10032,212-927-5600 
NEIGHBORHOOD SENIOR CENTE,32M01,ENCORE NEIGHBORHOOD SENIOR CENTER,ENCORE COMMUNITY SERVICES  ,239 WEST 49TH STREET,NEW YORK,10019,212-581-2910 
NEIGHBORHOOD SENIOR CENTE,32N01,JOHN PAUL II FRIENDSHIP NEIGHBORHOOD SC,POLISH & SLAVIC CENTER INC  ,103 EAST 7TH STREET,NEW YORK,10009,212-673-7704 
NEIGHBORHOOD SENIOR CENTE,32P01,LENOX HILL NEIGHBORHOOD SENIOR CENTER,LENOX HILL NEIGHBORHOOD HOUSE INC ,619 LEXINGTON AVENUE,NEW YORK,10022,212-308-1959 
NEIGHBORHOOD SENIOR CENTE,32R01,MOTT STREET NEIGHBORHOOD SENIOR CENTER,NEW YORK FOUNDATION FOR SENIOR CITIZENS INC ,180 MOTT STREET,NEW YORK,10012,212-966-5480 
NEIGHBORHOOD SENIOR CENTE,32T01,PSS HARLEM NEIGHBORHOOD SENIOR CENTER,PRESBYTERIAN SENIOR SERVICES  ,18 MT. MORRIS PARK WEST,NEW YORK,10027,212-222-3132 
NEIGHBORHOOD SENIOR CENTE,32T03,PSS MANHATTANVILLE SENIOR CENTER,PRESBYTERIAN SENIOR SERVICES  ,530 WEST 133RD STREET,NEW YORK,10027,212-862-5562 
NEIGHBORHOOD SENIOR CENTE,32W01,CARVER NEIGHBORHOOD SENIOR CENTER,INSTITUTE FOR THE PUERTO RICAN HISPANIC ELDERLY IN,55 EAST 102ND STREET,NEW YORK,10029,212-289-2708 
NEIGHBORHOOD SENIOR CENTE,32Y01,THE CENTER AT THE RED OAK NEIGHBR SR CTR,WEST SIDE FEDERATION FOR SENIOR AND SUPPORTIVE HOU,135 WEST 106TH STREET,NEW YORK,10025,646-214-2560 
NEIGHBORHOOD SENIOR CENTE,32Z01,OUR LADY OF POMPEII NSC,"GREENWICH HOUSE, INC. ",25 CARMINE STREET,NEW YORK,10014,212-989-3620 
NEIGHBORHOOD SENIOR CENTE,33201,CPC PROJECT OPEN DOOR NEIGHBORHOOD SC,CHINESE AMERICAN PLANNING COUNCIL INC,168 GRAND STREET,NEW YORK,10013,212-431-9026 
NEIGHBORHOOD SENIOR CENTE,33701,UJC ADULT LUNCHEON CLUB NSC,UNITED JEWISH COUNCIL OF THE EAST SIDE INC ,15 BIALYSTOKER PLACE,NEW YORK,10002,212-673-9328 
NEIGHBORHOOD SENIOR CENTE,33702,UJC Lillian Wald Houses Senior Center,UNITED JEWISH COUNCIL OF THE EAST SIDE INC ,12 AVENUE D,NEW YORK,10009,212-260-2731 
NEIGHBORHOOD SENIOR CENTE,33703,UJC Extended Services,UNITED JEWISH COUNCIL OF THE EAST SIDE INC ,465 Grand Street,NEW YORK,10002,212-233-6037 
NEIGHBORHOOD SENIOR CENTE,33W01,RAIN INWOOD NEIGHBORHOOD SENIOR CENTER,REGIONAL AID FOR INTERIM NEEDS INC ,84 VERMILYEA AVENUE,NEW YORK,10034,212-567-3200 
NEIGHBORHOOD SENIOR CENTE,34001,GOOD COMPANIONS NEIGHBORHOOD SENIOR CENT,HENRY STREET SETTLEMENT  ,334 MADISON STREET,NEW YORK,10002,212-349-2770 
NEIGHBORHOOD SENIOR CENTE,34101,CENTRAL HARLEM KENNEDY SR CTR,"CENTRAL HARLEM SENIOR CITIZENS CENTERS, INC.",2322 Third Avenue,NEW YORK,10037,212-926-4465 
NEIGHBORHOOD SENIOR CENTE,34103,Beatrice Lewis,"CENTRAL HARLEM SENIOR CITIZENS CENTERS, INC.",34 WEST 134TH STREET,NEW YORK,10037,212-289-9155 
NEIGHBORHOOD SENIOR CENTE,34901,HUDSON GUILD NEIGHBORHOOD CENTER,HUDSON GUILD  ,441 West 26th Street,NEW YORK,10011,212-760-9805 
NEIGHBORHOOD SENIOR CENTE,35001,BRC NEIGHBORHOOD SENIOR CENTER,BOWERY RESIDENTS COMMITTEE INC  ,30 DELANCEY STREET,NYC,10002,212-533-2020 
NEIGHBORHOOD SENIOR CENTE,35301,FIND WOODSTOCK NEIGHBORHOOD SENIOR CENTE,FIND AID FOR THE AGED  ,127  WEST 43RD STREET,NEW YORK,10036,212-874-0300 
NEIGHBORHOOD SENIOR CENTE,35A01,Hamilton Grange Neighborhood Senior Center,CONVENT AVENUE BAPTIST CHURCH  ,420 WEST 145TH STREET,NEW YORK,10031,212-862-4181 
NEIGHBORHOOD SENIOR CENTE,35B01,ARC Central Harlem Senior Center,ARC XVI FORT WASHINGTON INC  ,120 WEST 140TH STREET,NEW YORK,10039,212-781-5700 
NEIGHBORHOOD SENIOR CENTE,35B02,AP Randolph Senior Center,ARC XVI FORT WASHINGTON INC  ,108 West 146th Street,NEW YORK,10030,917-639-3054 
NEIGHBORHOOD SENIOR CENTE,36001,ABSW NEIGHBORHOOD SENIOR CENTER,ASSOCIATION OF BLACK SOCIAL WORKERS INC ,221 WEST 107TH STREET,NEW YORK,10025,212-749-8400 
NEIGHBORHOOD SENIOR CENTE,36B01,The Center at the Red Oak Neighborhood Senior Cent,WEST SIDE FEDERATION FOR SENIOR AND SUPPORTIVE HOU,135 WEST 106TH STREET,NEW YORK,10025,646-214-2560 
NEIGHBORHOOD SENIOR CENTE,37901,FIND CLINTON NEIGHBORHOOD SENIOR CENTER,FIND AID FOR THE AGED  ,530 West 55th Street,NEW YORK,10023,212-757-2026 
NEIGHBORHOOD SENIOR CENTE,39901,CORSI HOUSE NEIGHBORHOOD SENIOR CENTER,UNION SETTLEMENT ASSOCIATION ,307 East 116th Street,New York,10029,212-828-6756 
NEIGHBORHOOD SENIOR CENTE,40201,ROBERT COUCHE NEIGHBORHOOD SENIOR CEN,MERRILL PARK CIVIC ASSOCIATION OF SPRINGFIELD GARD,137-57 FARMERS BOULEVARD,SPRINGFIELD GAR,11434,718-978-8352 
NEIGHBORHOOD SENIOR CENTE,40301,RIDGEWOOD OLDER ADULT NEIGHBORHOOD SC,RIDGEWOOD OLDER ADULT CENTER AND SERVICES INC ,59-14 70TH AVENUE,RIDGEWOOD,11385,718-456-2000 
NEIGHBORHOOD SENIOR CENTE,40501,BROOKS MEMORIAL NSC,BROOKS SENIOR CENTER,143-22 109TH AVENUE,JAMAICA,11435,718-291-3955 
NEIGHBORHOOD SENIOR CENTE,40601,JSPOA FRIENDSHIP NSC,JAMAICA SERVICE PROGRAM FOR OLDER ADULTS INC ,92-47 165th STREET,JAMAICA,11433,718-657-6695 
NEIGHBORHOOD SENIOR CENTE,40901,FOREST HILLS NEIGHBORHOOD SENIOR CENTER,QUEENS COMMUNITY HOUSE INC. ,108-25 62ND DRIVE,FLUSHING,11375,718-699-1010 
NEIGHBORHOOD SENIOR CENTE,40902,FOREST HILLS NEIGHBORHOOD SENIOR CENTER,QUEENS COMMUNITY HOUSE INC. ,80-02 KEW GARDENS ROAD,KEW GARDENS,11415,718-699-1010 
NEIGHBORHOOD SENIOR CENTE,40B01,CCNS HOWARD BEACH NEIGHBORHOOD SC,CATHOLIC CHARITIES NEIGHBORHOOD SERVICES INC,155-55 CROSSBAY BOULEVARD,HOWARD BEACH,11414,718-738-8100 
NEIGHBORHOOD SENIOR CENTE,40C01,SUNNYSIDE COMMUNITY NSC,SUNNYSIDE COMMUNITY SERVICES INC ,43-31 39TH STREET,SUNNYSIDE,11104,929-335-7915 
NEIGHBORHOOD SENIOR CENTE,40M01,SELFHELP MASPETH NSC,SELFHELP COMMUNITY SERVICES INC ,69-61 GRAND AVENUE,MASPETH,11378,718-429-3636 
NEIGHBORHOOD SENIOR CENTE,40P01,ELMHURST JACKSON HEIGHTS NSC,INSTITUTE FOR THE PUERTO RICAN HISPANIC ELDERLY IN,75-01 BROADWAY,ELMHURST,11373,718-478-7171 
NEIGHBORHOOD SENIOR CENTE,40T01,QUEENSBRIDGE-RIIS NSC,JACOB A RIIS NEIGHBORHOOD SETTLEMENT ,10-25 41ST AVENUE,LONG ISLAND CIT,11101,718-784-7447 
NEIGHBORHOOD SENIOR CENTE,40U01,HANAC RAVENSWOOD NSC,"HANAC, INC. ",34-35 12TH STREET,ASTORIA,11106,718-786-1550 
NEIGHBORHOOD SENIOR CENTE,40X01,ROCKAWAY BLVD NSC,JAMAICA SERVICE PROGRAM FOR OLDER ADULTS INC ,123-10 143rd STREET,JAMAICA,11433,718-657-6752 
NEIGHBORHOOD SENIOR CENTE,40Z01,QUEENS VALLEY NSC,YOUNG ISRAEL PROGRAMS INC  ,141-55 77TH AVENUE,FLUSHING,11367,718-263-6995 
NEIGHBORHOOD SENIOR CENTE,41001,WAVECREST AND BAYSWATER NSC,YOUNG ISRAEL PROGRAMS INC  ,2716 HEALY AVENUE,FAR ROCKAWAY,11691,718-327-0297 
NEIGHBORHOOD SENIOR CENTE,41201,HANAC ANGELO PETROMELIS NSC,"HANAC, INC. ",13-28 123RD STREET,COLLEGE POINT,11356,718-961-0344 
NEIGHBORHOOD SENIOR CENTE,41301,ALLEN COMMUNITY NEIGHBORHOOD SENIOR CT,ALLEN AME CHURCH dba ALLEN COMMUNITY SENIOR CITIZE,166-01 LINDEN BOULEVARD,JAMAICA,11433,718-658-0980 
NEIGHBORHOOD SENIOR CENTE,41401,ALPHA PHI ALPHA NEIGHBORHOOD SENIOR CTR,ALPHA PHI ALPHA SENIOR CITIZENS CENTER INC ,220-01 LINDEN BOULEVARD,CAMBRIA HEIGHTS,11411,718-528-8238 
NEIGHBORHOOD SENIOR CENTE,41601,THE YOUNG ISRAEL OF FOREST HILLS NSC,YOUNG ISRAEL PROGRAMS INC  ,68-07 BURNS STREET,FOREST HILLS,11375,718-520-2305 
NEIGHBORHOOD SENIOR CENTE,41701,MIDDLE VILLAGE NEIGHBORHOOD SENIOR CT,RABBI ISRAEL MEYER HACOHEN RABBINICAL SEMINARY OF ,69-10 75th STREET,MIDDLE VILLAGE,11379,718-894-3441 
NEIGHBORHOOD SENIOR CENTE,41A01,KCS FLUSHING NSC,KOREAN COMMUNITY SERVICES OF METROPOLITAN NEW YORK,42-15 166TH STREET,FLUSHING,11358,718-886-8203 
NEIGHBORHOOD SENIOR CENTE,41G01,CCNS HILLCREST NEIGHBORHOOD SENIOR CTR,CATHOLIC CHARITIES NEIGHBORHOOD SERVICES INC,168-01 HILLSIDE AVENUE,JAMAICA,11432,718-287-7171 
NEIGHBORHOOD SENIOR CENTE,41H01,RAICES CORONA NEIGHBORHOOD SENIOR CENT,SPANISH SPEAKING ELDERLY COUNCIL RAICES INC.,107-24 CORONA AVENUE,CORONA,11368,718-458-7259 
NEIGHBORHOOD SENIOR CENTE,41Q01,WOODSIDE NEIGHBORHOOD SENIOR CENTER,"SAMARITAN DAYTOP VILLAGE, INC  ",50-37 NEWTOWN ROAD,WOODSIDE,11377,718-932-6916 
NEIGHBORHOOD SENIOR CENTE,41T01,KCS CORONA NEIGHBORHOOD SENIOR CENTER,KOREAN COMMUNITY SERVICES OF METROPOLITAN NEW YORK,37-06 111TH STREET,CORONA,11368,718-651-9220 
NEIGHBORHOOD SENIOR CENTE,41U01,ROY REUTHER NSC,THE JEWISH ASSOCIATION FOR SERVICES FOR THE AGED ,711C SEAGIRT AVENUE,FAR ROCKAWAY,11691,718-471-3110 
NEIGHBORHOOD SENIOR CENTE,41Y01,CCNS OZONE PARK NSC,CATHOLIC CHARITIES NEIGHBORHOOD SERVICES INC,103-02 101ST AVENUE,OZONE PARK,11416,718-847-2100 
NEIGHBORHOOD SENIOR CENTE,41Z01,CCNS DELLAMONICA-STEINWAY NSC,CATHOLIC CHARITIES NEIGHBORHOOD SERVICES INC,23-56 BROADWAY,ASTORIA,11106,718-626-1500 
NEIGHBORHOOD SENIOR CENTE,42701,CCNS CATHERINE SHERIDAN NSC,CATHOLIC CHARITIES NEIGHBORHOOD SERVICES INC,35-24 83RD STREET,JACKSON HEIGHTS,11372,718-458-4600 
NEIGHBORHOOD SENIOR CENTE,42801,PETER CARDELLA NSC,PETER CARDELLA SENIOR CITIZEN CENTER INC ,68-52 FRESH POND ROAD,RIDGEWOOD,11385,718-497-2908 
NEIGHBORHOOD SENIOR CENTE,42U01,CCNS SEASIDE NSC,CATHOLIC CHARITIES NEIGHBORHOOD SERVICES INC,320 BEACH 94TH STREET,ROCKAWAY,11693,347-926-4119 
NEIGHBORHOOD SENIOR CENTE,42Z01,ELMCOR LEFRAK NSC,ELMCOR YOUTH & ADULT ACTIVITIES INC ,95-18 NORTHERN BOULEVARD,JACKSON HEIGHTS,11372,718-271-1222 
NEIGHBORHOOD SENIOR CENTE,43101,SELFHELP CLEARVIEW NSC,SELFHELP COMMUNITY SERVICES INC ,208-11 26TH AVENUE,BAYSIDE,11360,718-224-7888 
NEIGHBORHOOD SENIOR CENTE,43301,BAYSIDE NEIGHBORHOOD SENIOR CENTER,CATHOLIC CHARITIES NEIGHBORHOOD SERVICES INC,221-15 HORACE HARDING EXPRESSWAY,BAYSIDE,11364,718-225-1144 
NEIGHBORHOOD SENIOR CENTE,43601,CCNS WOODHAVEN NSC,CATHOLIC CHARITIES NEIGHBORHOOD SERVICES INC,89-02 91ST STREET,JAMAICA,11421,718-847-9200 
NEIGHBORHOOD SENIOR CENTE,43701,REGO PARK NSC,QUEENS COMMUNITY HOUSE INC. ,93-29 QUEENS BOULEVARD,REGO PARK,11374,718-896-8511 
NEIGHBORHOOD SENIOR CENTE,43D01,SELFHELP LATIMER NST,SELFHELP COMMUNITY SERVICES INC ,34-30 137TH STREET,FLUSHING,11354,718-961-3660 
NEIGHBORHOOD SENIOR CENTE,43Q01,HOLLISWOOD NSC,THE JEWISH ASSOCIATION FOR SERVICES FOR THE AGED ,86-25 FRANCIS LEWIS BOULEVARD,JAMAICA,11427,718-454-6157 
NEIGHBORHOOD SENIOR CENTE,43Q02,JASA CLUB 76 SENIOR CENTER,THE JEWISH ASSOCIATION FOR SERVICES FOR THE AGED ,86-25 FRANCIS LEWIS BOULEVARD,JAMAICA,11427,212-712-0170 
NEIGHBORHOOD SENIOR CENTE,43Q03,JASA ONE STOP,THE JEWISH ASSOCIATION FOR SERVICES FOR THE AGED ,86 25 FRANCIS LEWIS BOULEVARD,JAMAICA,11427,212-864-7900 
NEIGHBORHOOD SENIOR CENTE,43S01,RAICES ASTORIA NEIGHBORHOOD SENIOR CTR,SPANISH SPEAKING ELDERLY COUNCIL RAICES INC.,21-21 30TH DRIVE,LONG ISLAND CIT,11102,718-726-9642 
NEIGHBORHOOD SENIOR CENTE,43U01,SAMUEL FIELD NEIGHBORHOOD SENIOR CENTER,SAMUEL FIELD YM & YWHA INC  ,58-20 LITTLE NECK PARKWAY,LITTLE NECK,11362,718-225-6750 
NEIGHBORHOOD SENIOR CENTE,44001,BROOKDALE NSC,THE JEWISH ASSOCIATION FOR SERVICES FOR THE AGED ,131 BEACH 19TH STREET,FAR ROCKAWAY,11691,718-471-3200 
NEIGHBORHOOD SENIOR CENTE,44301,ROCKAWAY PARK NSC,THE JEWISH ASSOCIATION FOR SERVICES FOR THE AGED ,106-20  Shore Front Parkway,ROCKAWAY PARK,11694,718-634-3044 
NEIGHBORHOOD SENIOR CENTE,44701,ELMCOR NSC,ELMCOR YOUTH & ADULT ACTIVITIES INC ,98-19 ASTORIA BOULEVARD,EAST ELMHURST,11369,718-457-9757 
NEIGHBORHOOD SENIOR CENTE,44D01,ROCHDALE NEIGHBORHOOD SENIOR CENTER,ROCHDALE VILLAGE SOCIAL SERVICES INC ,169-65 137TH AVENUE,JAMAICA,11434,718-525-2800 
NEIGHBORHOOD SENIOR CENTE,44J01,ALLEN AME CHURCH THEODORA JACKSON NSC,JAMAICA SERVICE PROGRAM FOR OLDER ADULTS INC ,92-47 165TH STREET,JAMAICA,11433,718-657-6618 
NEIGHBORHOOD SENIOR CENTE,44L01,SELFHELP AUSTIN STREET NSC,SELFHELP COMMUNITY SERVICES INC ,106-06 QUEENS BOULEVARD,FOREST HILLS,11375,718-520-8197 
NEIGHBORHOOD SENIOR CENTE,44U01,BROOKVILLE NSC,SERVICES NOW FOR ADULT PERSONS INC ,133-33 BROOKVILLE BOULEVARD,ROSEDALE,11422,718-525-8899 
NEIGHBORHOOD SENIOR CENTE,45701,NEWTOWN ITALIAN NSC,ITALIAN SENIOR CITIZENS CENTER INC.,83-20  QUEENS BOULEVARD,ELMHURST,11373,718-335-7272 
NEIGHBORHOOD SENIOR CENTE,46001,CORONA NEIGHBORHOOD SENIOR CENTER,INSTITUTE FOR THE PUERTO RICAN HISPANIC ELDERLY IN,10874 Roosevelt Ave,CORONA,11368,718-639-2000 
NEIGHBORHOOD SENIOR CENTE,47601,CPC NAN SHAN NSC,CHINESE AMERICAN PLANNING COUNCIL INC,133-14  41st Avenue,FLUSHING,11355,718-358-3030 
NEIGHBORHOOD SENIOR CENTE,49601,FLORENCE E. SMITH NSC,CORONA CONGREGATIONAL CHURCH  ,102-19 34TH AVENUE,CORONA,11368,718-899-0553 
