Contract Type,Provider ID,Program Name,Sponsor Name,Program Address,Program Borough,Program Zipcode,Program Phone
NEIGHBORHOOD SENIOR CENTE,4A201,POMONOK NEIGHBORHOOD SENIOR CENTER,QUEENS COMMUNITY HOUSE INC. ,67-09 KISSENA BOULEVARD,FLUSHING,11367,718-591-3377 
NEIGHBORHOOD SENIOR CENTE,50201,ARROCHAR NEIGHBORHOOD SENIOR CENTER,STATEN ISLAND COMMUNITY SERVICES FRIENDSHIP CLUBS ,85 JEROME AVENUE,STATEN ISLAND,10305,718-720-6110 
NEIGHBORHOOD SENIOR CENTE,50601,GREAT KILLS NEIGHBORHOOD SENIOR CENTER,STATEN ISLAND COMMUNITY SERVICES FRIENDSHIP CLUBS ,11 SAMPSON AVENUE,STATEN ISLAND,10308,718-356-5050 
NEIGHBORHOOD SENIOR CENTE,50701,JCC SOUTH SHORE NEIGHBORHOOD SENIOR CT,JEWISH COMMUNITY CENTER OF STATEN ISLAND INC ,1297 ARTHUR KILL ROAD,STATEN ISLAND,10312,718-475-5283 
NEIGHBORHOOD SENIOR CENTE,50A01,TODT HILL NEIGHBORHOOD SENIOR CENTER,STATEN ISLAND COMMUNITY SERVICES FRIENDSHIP CLUBS ,184 SCHMIDTS LANE,STATEN ISLAND,10314,718-720-6110 
NEIGHBORHOOD SENIOR CENTE,50B01,MOUNT LORETTO NEIGHBORHOOD SENIOR CEN,STATEN ISLAND COMMUNITY SERVICES FRIENDSHIP CLUBS ,6581 HYLAN BOULEVARD,STATEN ISLAND,10309,718-984-8589 
NEIGHBORHOOD SENIOR CENTE,50R01,CASSIDY COLES NEIGHBORHOOD SENIOR CENT,COMMUNITY AGENCY FOR SENIOR CITIZENS INC ,125 CASSIDY PLACE,STATEN ISLAND,10301,718-273-6808 
NEIGHBORHOOD SENIOR CENTE,50R02,CASC ASSISTANCE,COMMUNITY AGENCY FOR SENIOR CITIZENS INC ,56 BAY STREET,STATEN ISLAND,10301,718-273-6808 
NEIGHBORHOOD SENIOR CENTE,53601,ANDERSON NEIGHBORHOOD SENIOR CENTER,"CATHOLIC CHARITIES OF STATEN ISLAND, INC.",120 ANDERSON AVENUE,STATEN ISLAND,10302,718-448-5757 
NEIGHBORHOOD SENIOR CENTE,53701,NEW LANE NEIGHBORHOOD SENIOR CENTER,COMMUNITY AGENCY FOR SENIOR CITIZENS INC ,70 NEW LANE,STATEN ISLAND,10305,718-448-5936 
NEIGHBORHOOD SENIOR CENTE,54001,STAPLETON NEIGHBORHOOD SENIOR CENTER,JEWISH COMMUNITY CENTER OF STATEN ISLAND INC ,189 GORDON STREET,STATEN ISLAND,10304,718-981-8828 
NEIGHBORHOOD SENIOR CENTE,54101,WEST BRIGHTON NEIGHBORHOOD SENIOR CENT,"CATHOLIC CHARITIES OF STATEN ISLAND, INC.",230 BROADWAY,STATEN ISLAND,10310,718-727-9763 
NORC SITES,N3401,STANLEY M ISAACS NORC,STANLEY M ISAACS NEIGHBORHOOD CENTER INC ,415 EAST 93RD STREET,NEW YORK,10128,212-360-7620 
NORC SITES,N3E01,ISABELLA GERIATRIC FT GEORGE VISTAS NORC,ISABELLA GERIATRIC CENTER INC  ,17 FT. GEORGE HILL,NEW YORK,10040,212-304-1064 
NORC SITES,N3E02,EL CORAZON NNORC,ISABELLA GERIATRIC CENTER INC  ,4026 BROADWAY,NEW YORK,10032,212-342-9617 
NORC SITES,N3E03,ISABELLA GERIATRIC RIVER TERRACE NORC,ISABELLA GERIATRIC CENTER INC  ,156-20 Riverside Drive West,NEW YORK,10032,646-230-8530 
NORC SITES,N4801,SELFHELP FRESH MEADOWS NORC,SELFHELP COMMUNITY SERVICES INC ,67-00 192  STREET,FRESH MEADOWS,11365,718-454-6288 
OTHER SATELLITE,12T02,JASA EINSTEIN SENIOR CENTER,THE JEWISH ASSOCIATION FOR SERVICES FOR THE AGED ,135 EINSTEIN LOOP,BRONX,10475,718-379-2702 
OTHER SATELLITE,18202,Patterson Houses Senior Center,EAST SIDE HOUSE INC  ,308 EAST 145TH STREET,BRONX,10451,718-993-5146 
OTHER SATELLITE,21602,FARRAGUT SENIOR CENTER,SPANISH SPEAKING ELDERLY COUNCIL RAICES INC.,228 YORK STREET,BROOKLYN,11201,718-422-1069 
OTHER SATELLITE,21603,RAICES GOWANUS SENIOR CENTER,SPANISH SPEAKING ELDERLY COUNCIL RAICES INC.,420 BALTIC STREET,BROOKLYN,11201,718-797-2472 
OTHER SATELLITE,30A02,Polo Grounds,COTHOA LUNCHEON CLUB INC  ,2965 EIGHTH AVENUE,NEW YORK,10039,212-283-5475 
SOCIAL CLUB,12E02,Fort Independence Social Club,CHILD DEVELOPMENT CENTER OF THE MOSHOLU-MONTEFIORE,3340 BAILEY AVENUE,BRONX,10463,718-796-2950 
SOCIAL CLUB,20202,Marcus Garvey Social Club,FORT GREENE COUNCIL ,1440 E NEW YORK AVENUE,BROOKLYN,11212,718-346-7167 
SOCIAL CLUB,20203,SETH LOW SOCIAL CLUB,FORT GREENE COUNCIL ,137 BELMONT AVENUE,BROOKLYN,11212,718-485-4991 
SOCIAL CLUB,26W02,Cooper Park Social Club,THE JEWISH ASSOCIATION FOR SERVICES FOR THE AGED ,288 FROST STREET,BROOKLYN,11222,718-408-6328 
SOCIAL CLUB,30A03,Ralph J. Rangel Social Club,COTHOA LUNCHEON CLUB INC  ,159-36 HARLEM RIVER DRIVE,NEW YORK,10039,646-918-7570 
SOCIAL CLUB,32B02,MELTZER TOWER SOCIAL CLUB,UNIVERSITY SETTLEMENT SOCIETY OF NEW YORK,94 EAST 1ST STREET,NEW YORK,10009,212-253-5624 
SOCIAL CLUB,32T02,KING TOWERS SOCIAL CLUB,PRESBYTERIAN SENIOR SERVICES  ,50 LENOX AVENUE,NEW YORK,10028,646-861-2077 
SOCIAL CLUB,32Y02,DOUGLAS SOCIAL CLUB,WEST SIDE FEDERATION FOR SENIOR AND SUPPORTIVE HOU,868 AMSTERDAM AVENUE,NEW YORK,10025,646-214-2560 
SOCIAL CLUB,34102,Saint Nicholas Social Club,"CENTRAL HARLEM SENIOR CITIZENS CENTERS, INC.",210 WEST 131ST STREET,NEW YORK,10001,646-678-4451 
SOCIAL SERVICES ONLY,15602,RAIN ONE STOP SERVICES FOR ELDERLY,REGIONAL AID FOR INTERIM NEEDS INC ,1380 METROPOLITAN AVENUE,BRONX,10462,718-239-4358 
SOCIAL SERVICES ONLY,15E02,Neighborhood SHOPP SNAP,THE NEIGHBORHOOD SELF-HELP BY OLDER PERSONS PROJEC,910 EAST 172ND STREET,BRONX,10460,718-620-4650 
SOCIAL SERVICES ONLY,20602,Polish and Slavic Extended Social Services,POLISH & SLAVIC CENTER INC  ,176 JAVA STREET,BROOKLYN,11222,718-383-3324 
SOCIAL SERVICES ONLY,28D02,AMICO Extended Services,AMERICAN ITALIAN COALITION OF ORGANIZATIONS INC\AM,138 BAY 20TH  STREET,BROOKLYN,11214,718-256-3445 
SOCIAL SERVICES ONLY,31203,BURDEN CENTER ON AGING,"CARTER BURDEN NETWORK, INC.",351 EAST 74TH STREET,NEW YORK,10021,212-879-7400 
TRANSPORTATION ONLY,53801,CASC TRANSPORTATION,COMMUNITY AGENCY FOR SENIOR CITIZENS INC ,56 BAY STREET,STATEN ISLAND,10301,718-981-6226 
